<?xml version="1.0" encoding="UTF-8"?>

<digidex xmlns:xs="http://www.w3.org/2001/XMLSchema-instance"
    xsi:noNamespaceSchemaLocation="digidex.xsd">
    
    <digimon>
        <name>Agumon</name>
        <type>fuego</type>
        <level>60</level>
        <abilities>
            <ability>Pepper Breath</ability>
        </abilities>
        <baseStats>
            <HP>1000</HP>
            <ATK>1000</ATK>
            <DEF>1000</DEF>
        </baseStats>
        <legendary />
    </digimon>

    <digimon>
        <name>Gabumon</name>
        <type>energia</type>
        <level>50</level>
        <abilities>
            <ability>Blue Blaster</ability>
            <ability>Petit Fire</ability>
        </abilities>
        <baseStats>
            <HP>1000</HP>
            <ATK>1000</ATK>
            <DEF>1000</DEF>
        </baseStats>
    </digimon>

</digidex>
